{
  "graph_id": "evidence-3d6bd0b48d53b5f6018bff58",
  "as_of_utc": "2026-08-10T19:45:00Z",
  "nodes": [
    {
      "id": "estimate:direction:semiconductors",
      "kind": "estimate",
      "label": "negative",
      "payload": {
        "observer_id": "direction",
        "eligible": true,
        "uncertainty": 0.2,
        "data_ready": true,
        "model_estimated": true,
        "decision_eligible": true
      }
    },
    {
      "id": "observation:synthetic:observer_conflict_next_probe:direction",
      "kind": "observation",
      "label": "synthetic:observer_conflict_next_probe:direction",
      "payload": {}
    },
    {
      "id": "estimate:transmission:semiconductors",
      "kind": "estimate",
      "label": "negative_coherence",
      "payload": {
        "observer_id": "transmission",
        "eligible": true,
        "uncertainty": 0.2,
        "data_ready": true,
        "model_estimated": true,
        "decision_eligible": true
      }
    },
    {
      "id": "observation:synthetic:observer_conflict_next_probe:transmission",
      "kind": "observation",
      "label": "synthetic:observer_conflict_next_probe:transmission",
      "payload": {}
    },
    {
      "id": "estimate:episode:semiconductors",
      "kind": "estimate",
      "label": "mature",
      "payload": {
        "observer_id": "episode",
        "eligible": true,
        "uncertainty": 0.2,
        "data_ready": true,
        "model_estimated": true,
        "decision_eligible": true
      }
    },
    {
      "id": "observation:synthetic:observer_conflict_next_probe:episode",
      "kind": "observation",
      "label": "synthetic:observer_conflict_next_probe:episode",
      "payload": {}
    },
    {
      "id": "estimate:theme_radar_attention:semiconductors",
      "kind": "estimate",
      "label": "accelerating",
      "payload": {
        "observer_id": "theme_radar_attention",
        "eligible": true,
        "uncertainty": 0.2,
        "data_ready": true,
        "model_estimated": true,
        "decision_eligible": false
      }
    },
    {
      "id": "observation:synthetic:observer_conflict_next_probe:theme_radar_attention",
      "kind": "observation",
      "label": "synthetic:observer_conflict_next_probe:theme_radar_attention",
      "payload": {}
    },
    {
      "id": "estimate:fragility:semiconductors",
      "kind": "estimate",
      "label": "medium",
      "payload": {
        "observer_id": "fragility",
        "eligible": true,
        "uncertainty": 0.2,
        "data_ready": true,
        "model_estimated": true,
        "decision_eligible": true
      }
    },
    {
      "id": "observation:synthetic:observer_conflict_next_probe:fragility",
      "kind": "observation",
      "label": "synthetic:observer_conflict_next_probe:fragility",
      "payload": {}
    }
  ],
  "edges": [
    {
      "source": "observation:synthetic:observer_conflict_next_probe:direction",
      "target": "estimate:direction:semiconductors",
      "relation": "supports",
      "weight": null
    },
    {
      "source": "observation:synthetic:observer_conflict_next_probe:transmission",
      "target": "estimate:transmission:semiconductors",
      "relation": "supports",
      "weight": null
    },
    {
      "source": "observation:synthetic:observer_conflict_next_probe:episode",
      "target": "estimate:episode:semiconductors",
      "relation": "supports",
      "weight": null
    },
    {
      "source": "observation:synthetic:observer_conflict_next_probe:theme_radar_attention",
      "target": "estimate:theme_radar_attention:semiconductors",
      "relation": "supports",
      "weight": null
    },
    {
      "source": "observation:synthetic:observer_conflict_next_probe:fragility",
      "target": "estimate:fragility:semiconductors",
      "relation": "supports",
      "weight": null
    },
    {
      "source": "estimate:theme_radar_attention:semiconductors",
      "target": "estimate:direction:semiconductors",
      "relation": "contradicts",
      "weight": null
    }
  ]
}
